"","Banco de Dados II"
"","Ementa: SQL Avançada, DDL, DML. Restrições de integridade de dados, tipos"
"","de  junções,  manipulação  de  junções  de  tabelas.  Funções  de  agregação,"
"","operações  sobre  conjuntos.  Operações  sobre  Visões  em  banco  de  dados."
"","Processamento  e  otimização  de  consultas.  Stored  Procedures.  Functions."
"","Triggers. Transações. Controle de concorrência e recuperação."
"Bibliografia Básica",""
"•","TEOREY, Toby; VIEIRA, Daniel (Trad.). Projeto e modelagem de banco de"
