"Assim","como 
atua 
em 
relação 
à 
vida 
acadêmica  do  discente,  o  NAD 
exerce  o"
"acompanhamento de egressos do curso, mantendo a comunicação com eles e acompanhando",""
"no que cabe, a sua inserção no mundo do trabalho. Para tanto, atua da seguinte forma:",""
"•","Comunicação  aos  egressos  do  curso  sobre  os  programas  e  projetos  de  extensão"
"","desenvolvidos  na  Faculdade,  incentivando  o  conhecimento  a  respeito  deles  e  sua"
"","participação nas ações abertas à comunidade;"
"•","Comunicação  aos egressos  referente  a  cursos  de  aperfeiçoamento profissional  e de"
"","pós-graduação, incentivando sua participação e o contínuo desenvolvimento de sua"
"","formação;"
"•","Comunicação  aos  egressos  sobre  eventos,  cursos  e  ações  de  compartilhamento  de"
"","experiências  e  troca  de  conhecimentos  entre  eles  e  a  comunidade  acadêmica  nas"
"","ocasiões de semanas pedagógicas e outras ofertadas no âmbito do curso;"
"•","Promoção de momentos de confraternização da comunidade acadêmica estendidos à"
"","participação dos egressos no que couber;"
"•","Contato  e  comunicação  efetivos  com  os  egressos  referentes  à  sua  participação  no"
"","processo de Avaliação Institucional, em colaboração com a CPA da Faculdade, tal como"
"","é preconizado pelo Sistema Nacional de Avaliação do Ensino Superior (SINAES)."
